{
	"id": "10003790",
	"name": "Logic",
	"broaderTerm": "10003752",
	"narrowerTerms": [
		"10002990",
		"10003792",
		"10003793",
		"10003794",
		"10003795",
		"10003796",
		"10003797",
		"10003798",
		"10003799",
		"10003800",
		"10003801",
		"10003806",
		"10011119",
		"10011192",
		"10011740",
		"10011741",
		"10011742"
	]
}
